{
  "kbVersion": "1.0.0",
  "generated": "2026-10-01",
  "curator": "Literature Curator + Data-Rigor Lead (Opus)",
  "schema": "./schema.json",
  "relations": [
    {
      "id": "rel:part_of:system:cardiovascular",
      "from": "system:cardiovascular",
      "to": "organism:body",
      "type": "part_of",
      "evidence": [
        "ev:guyton-hall-2021"
      ],
      "notes": "Hierarchy edge mirroring the entity parent field (primary containment used by the scale ladder)."
    },
    {
      "id": "rel:part_of:system:renal",
      "from": "system:renal",
      "to": "organism:body",
      "type": "part_of",
      "evidence": [
        "ev:guyton-hall-2021"
      ],
      "notes": "Hierarchy edge mirroring the entity parent field (primary containment used by the scale ladder)."
    },
    {
      "id": "rel:part_of:system:gi",
      "from": "system:gi",
      "to": "organism:body",
      "type": "part_of",
      "evidence": [
        "ev:guyton-hall-2021",
        "ev:leiper-2015"
      ],
      "notes": "Hierarchy edge mirroring the entity parent field (primary containment used by the scale ladder)."
    },
    {
      "id": "rel:part_of:system:endocrine",
      "from": "system:endocrine",
      "to": "organism:body",
      "type": "part_of",
      "evidence": [
        "ev:guyton-hall-2021"
      ],
      "notes": "Hierarchy edge mirroring the entity parent field (primary containment used by the scale ladder)."
    },
    {
      "id": "rel:part_of:system:nervous",
      "from": "system:nervous",
      "to": "organism:body",
      "type": "part_of",
      "evidence": [
        "ev:guyton-hall-2021",
        "ev:bourque-2008"
      ],
      "notes": "Hierarchy edge mirroring the entity parent field (primary containment used by the scale ladder)."
    },
    {
      "id": "rel:part_of:system:musculoskeletal",
      "from": "system:musculoskeletal",
      "to": "organism:body",
      "type": "part_of",
      "evidence": [
        "ev:guyton-hall-2021"
      ],
      "notes": "Hierarchy edge mirroring the entity parent field (primary containment used by the scale ladder)."
    },
    {
      "id": "rel:part_of:system:integumentary",
      "from": "system:integumentary",
      "to": "organism:body",
      "type": "part_of",
      "evidence": [
        "ev:guyton-hall-2021",
        "ev:wiig-2018"
      ],
      "notes": "Hierarchy edge mirroring the entity parent field (primary containment used by the scale ladder)."
    },
    {
      "id": "rel:part_of:system:respiratory",
      "from": "system:respiratory",
      "to": "organism:body",
      "type": "part_of",
      "evidence": [
        "ev:guyton-hall-2021",
        "ev:sparks-2014"
      ],
      "notes": "Hierarchy edge mirroring the entity parent field (primary containment used by the scale ladder)."
    },
    {
      "id": "rel:part_of:organ:heart",
      "from": "organ:heart",
      "to": "system:cardiovascular",
      "type": "part_of",
      "evidence": [
        "ev:guyton-hall-2021"
      ],
      "notes": "Hierarchy edge mirroring the entity parent field (primary containment used by the scale ladder)."
    },
    {
      "id": "rel:part_of:organ:aorta",
      "from": "organ:aorta",
      "to": "system:cardiovascular",
      "type": "part_of",
      "evidence": [
        "ev:guyton-hall-2021"
      ],
      "notes": "Hierarchy edge mirroring the entity parent field (primary containment used by the scale ladder)."
    },
    {
      "id": "rel:part_of:organ:vena-cava",
      "from": "organ:vena-cava",
      "to": "system:cardiovascular",
      "type": "part_of",
      "evidence": [
        "ev:guyton-hall-2021",
        "ev:potter-2006"
      ],
      "notes": "Hierarchy edge mirroring the entity parent field (primary containment used by the scale ladder)."
    },
    {
      "id": "rel:part_of:organ:kidney",
      "from": "organ:kidney",
      "to": "system:renal",
      "type": "part_of",
      "evidence": [
        "ev:guyton-hall-2021",
        "ev:palmer-schnermann-2015"
      ],
      "notes": "Hierarchy edge mirroring the entity parent field (primary containment used by the scale ladder)."
    },
    {
      "id": "rel:part_of:organ:ureters",
      "from": "organ:ureters",
      "to": "system:renal",
      "type": "part_of",
      "evidence": [
        "ev:guyton-hall-2021"
      ],
      "notes": "Hierarchy edge mirroring the entity parent field (primary containment used by the scale ladder)."
    },
    {
      "id": "rel:part_of:organ:bladder",
      "from": "organ:bladder",
      "to": "system:renal",
      "type": "part_of",
      "evidence": [
        "ev:guyton-hall-2021"
      ],
      "notes": "Hierarchy edge mirroring the entity parent field (primary containment used by the scale ladder)."
    },
    {
      "id": "rel:part_of:organ:stomach",
      "from": "organ:stomach",
      "to": "system:gi",
      "type": "part_of",
      "evidence": [
        "ev:guyton-hall-2021",
        "ev:leiper-2015"
      ],
      "notes": "Hierarchy edge mirroring the entity parent field (primary containment used by the scale ladder)."
    },
    {
      "id": "rel:part_of:organ:intestine",
      "from": "organ:intestine",
      "to": "system:gi",
      "type": "part_of",
      "evidence": [
        "ev:guyton-hall-2021",
        "ev:peronnet-2012"
      ],
      "notes": "Hierarchy edge mirroring the entity parent field (primary containment used by the scale ladder)."
    },
    {
      "id": "rel:part_of:organ:small-intestine",
      "from": "organ:small-intestine",
      "to": "organ:intestine",
      "type": "part_of",
      "evidence": [
        "ev:guyton-hall-2021",
        "ev:leiper-2015"
      ],
      "notes": "Hierarchy edge mirroring the entity parent field (primary containment used by the scale ladder)."
    },
    {
      "id": "rel:part_of:organ:liver",
      "from": "organ:liver",
      "to": "system:gi",
      "type": "part_of",
      "evidence": [
        "ev:guyton-hall-2021",
        "ev:sparks-2014"
      ],
      "notes": "Hierarchy edge mirroring the entity parent field (primary containment used by the scale ladder)."
    },
    {
      "id": "rel:part_of:organ:lung",
      "from": "organ:lung",
      "to": "system:respiratory",
      "type": "part_of",
      "evidence": [
        "ev:guyton-hall-2021",
        "ev:sparks-2014"
      ],
      "notes": "Hierarchy edge mirroring the entity parent field (primary containment used by the scale ladder)."
    },
    {
      "id": "rel:part_of:organ:pituitary",
      "from": "organ:pituitary",
      "to": "system:endocrine",
      "type": "part_of",
      "evidence": [
        "ev:guyton-hall-2021",
        "ev:bourque-2008"
      ],
      "notes": "Hierarchy edge mirroring the entity parent field (primary containment used by the scale ladder)."
    },
    {
      "id": "rel:part_of:organ:hypothalamus",
      "from": "organ:hypothalamus",
      "to": "organ:brain",
      "type": "part_of",
      "evidence": [
        "ev:guyton-hall-2021",
        "ev:bourque-2008"
      ],
      "notes": "Hierarchy edge mirroring the entity parent field (primary containment used by the scale ladder)."
    },
    {
      "id": "rel:part_of:organ:adrenal",
      "from": "organ:adrenal",
      "to": "system:endocrine",
      "type": "part_of",
      "evidence": [
        "ev:guyton-hall-2021",
        "ev:vinson-2016"
      ],
      "notes": "Hierarchy edge mirroring the entity parent field (primary containment used by the scale ladder)."
    },
    {
      "id": "rel:part_of:organ:brain",
      "from": "organ:brain",
      "to": "system:nervous",
      "type": "part_of",
      "evidence": [
        "ev:guyton-hall-2021",
        "ev:zimmerman-2017"
      ],
      "notes": "Hierarchy edge mirroring the entity parent field (primary containment used by the scale ladder)."
    },
    {
      "id": "rel:part_of:organ:skin",
      "from": "organ:skin",
      "to": "system:integumentary",
      "type": "part_of",
      "evidence": [
        "ev:guyton-hall-2021",
        "ev:wiig-2018"
      ],
      "notes": "Hierarchy edge mirroring the entity parent field (primary containment used by the scale ladder)."
    },
    {
      "id": "rel:part_of:tissue:muscle",
      "from": "tissue:muscle",
      "to": "system:musculoskeletal",
      "type": "part_of",
      "evidence": [
        "ev:guyton-hall-2021"
      ],
      "notes": "Hierarchy edge mirroring the entity parent field (primary containment used by the scale ladder)."
    },
    {
      "id": "rel:part_of:tissue:cardiac-atrium",
      "from": "tissue:cardiac-atrium",
      "to": "organ:heart",
      "type": "part_of",
      "evidence": [
        "ev:guyton-hall-2021",
        "ev:potter-2006"
      ],
      "notes": "Hierarchy edge mirroring the entity parent field (primary containment used by the scale ladder)."
    },
    {
      "id": "rel:part_of:tissue:supraoptic-nucleus",
      "from": "tissue:supraoptic-nucleus",
      "to": "organ:hypothalamus",
      "type": "part_of",
      "evidence": [
        "ev:bourque-2008"
      ],
      "notes": "Hierarchy edge mirroring the entity parent field (primary containment used by the scale ladder)."
    },
    {
      "id": "rel:part_of:tissue:paraventricular-nucleus",
      "from": "tissue:paraventricular-nucleus",
      "to": "organ:hypothalamus",
      "type": "part_of",
      "evidence": [
        "ev:bourque-2008"
      ],
      "notes": "Hierarchy edge mirroring the entity parent field (primary containment used by the scale ladder)."
    },
    {
      "id": "rel:part_of:tissue:ovlt",
      "from": "tissue:ovlt",
      "to": "organ:brain",
      "type": "part_of",
      "evidence": [
        "ev:bourque-2008",
        "ev:zimmerman-2017"
      ],
      "notes": "Hierarchy edge mirroring the entity parent field (primary containment used by the scale ladder)."
    },
    {
      "id": "rel:part_of:tissue:subfornical-organ",
      "from": "tissue:subfornical-organ",
      "to": "organ:brain",